id,member_id,title,content,type,priority,reasoning,customer_segment,purchase_pattern,risk_level,potential_value,is_active,created_at,updated_at
cl001,1,"推荐运动装备","建议向该客户推荐运动套装，与其购买的运动鞋形成搭配","product_recommendation","medium","客户购买了运动鞋，可能对运动装备感兴趣","运动爱好者","定期购买运动用品","low","medium",true,"2024-01-16 10:00:00","2024-01-16 10:00:00"
cl002,2,"VIP客户维护","该客户消费频次高，建议提供VIP专属优惠","retention","high","客户购买频次高，总消费金额大，属于高价值客户","高价值客户","频繁购买，单价较高","low","high",true,"2024-01-21 11:00:00","2024-01-21 11:00:00"
cl003,3,"唤醒沉睡客户","客户较长时间未购买，建议主动联系推荐新品","promotion","medium","客户最后购买时间较久，需要激活","潜在流失客户","低频购买","medium","medium",true,"2024-01-10 09:00:00","2024-01-10 09:00:00"
cl004,4,"退货客户关怀","客户有退货记录，需要重点关注服务质量","retention","high","客户有退货经历，需要挽回信任","价格敏感客户","对质量要求高","medium","medium",true,"2024-01-15 16:00:00","2024-01-15 16:00:00"
cl005,5,"长期未购买提醒","客户长期未购买，建议发送优惠券激活","upselling","low","客户已较长时间未活跃","沉睡客户","极低频购买","high","low",true,"2024-01-01 12:00:00","2024-01-01 12:00:00"